question,answer,contexts,ground_truth
What is the main objective of the IGF Code?,"The main objective of the IGF Code is to ensure safety on ships that use gases or other low-flashpoint fuels. The Code addresses all areas that need special consideration for the usage of these types of fuel and provides regulations to meet functional requirements for natural gas fuel, with additional regulations for other low-flashpoint fuels to be added as they are developed by the Organization.","Convention, 
 
HAVING CONSIDERED, at its ninety-fifth session, the draft International Code of Safety for 
Ships using Gases or other Low-flashpoint Fuels, 
 
1 ADOPTS the IGF Code , the t ext of which is set out in the a nnex to the present 
resolution; 
 
2 INVITES Contracting Governments to the Convention to note that the IGF Code will 
take effect on 1 January 2017 upon entry into force of amendments to chapters II-1, II-2 and 
the appendix to the annex of the Convention; 
 
3 INVITES ALSO Contracting Governments to consider the voluntary application of the 
IGF Code, as far as practicable, to cargo ships of less than 500 gross tonnage using gases or 
other low-flashpoint fuels; 
 
4 RECOGNIZES that requirements for additional low-flashpoint fuels will be added to the 
IGF Code, as and when they are developed by the Organization; 
 
5 REQUESTS the Secretary-General of the Organization to transmit certified copies of

---

new fuels technology, the Organization will periodically revie w this Code, taking into account 
both experience and technical developments. 
 
This Code addresses all areas that need special consideration for the usage of the low-flashpoint 
fuel. The basic philosophy of the IGF Code considers the goal based approach (MSC.1/Circ.1394). 
Therefore, goals and functional requirements were specified for each section forming the basis 
for the design, construction and operation. 
 
The current version of this Code includes regulations to meet the functional requirements for 
natural gas fuel. Regulations for other low-flashpoint fuels will be added to this Code as, and  
when, they are developed by the Organization.  
 
In the meantime, for other low-flashpoint fuels, compliance with the functional requirements of 
this Code must be demonstrated through alternative design.

---

5 REQUESTS the Secretary-General of the Organization to transmit certified copies of 
the present resolution and the text of the IGF Code, contained in the annex, to all Contracting 
Governments to the Convention; 
 
6 REQUESTS ALSO the Secretary-General of the Org anization to transmit copies of 
the present resolution and the text of the IGF Code contained in the annex to all Members of 
the Organization which are not Contracting Governments to the SOLAS Convention.

---

MSC 95/22/Add.1 
Annex 1, page 1 
 
 
I:\MSC\95\MSC 95-22-ADD.1 (E).docx 
ANNEX 1 
 
RESOLUTION MSC.391(95)  
(adopted on 11 June 2015) 
 
ADOPTION OF THE INTERNATIONAL CODE OF SAFETY FOR SHIPS USING GASES 
OR OTHER LOW-FLASHPOINT FUELS (IGF CODE) 
 
 
THE MARITIME SAFETY COMMITTEE, 
 
RECALLING Article 28(b) of the Convention on the International Maritime Organization 
concerning the function of the Committee, 
 
RECOGNIZING the need for a mandatory code for ships using gases or other low -flashpoint 
fuels, 
 
NOTING resolution MSC .392(95), by which it adopted, inter alia,  amendments to 
chapters II-1,II-2 and the appendix to the annex of the International Convention for the Safety 
of Life at Sea, 1974  (""the Convention""), to make the provisions of the International Code of 
Safety for Ships using Gases or other  Low-flashpoint Fuels (IGF Code) mandatory under the 
Convention, 
 
HAVING CONSIDERED, at its ninety-fifth session, the draft International Code of Safety for","The IGF Code establishes standards and guidance to ensure integrity, governance, and responsible conduct in the relevant IGF framework."
Who are the intended stakeholders or users of the IGF Code?,"The intended stakeholders or users of the IGF Code are:

* Contracting Governments to the Convention
* Members of the Organization which are not Contracting Governments to the SOLAS Convention.","Convention, 
 
HAVING CONSIDERED, at its ninety-fifth session, the draft International Code of Safety for 
Ships using Gases or other Low-flashpoint Fuels, 
 
1 ADOPTS the IGF Code , the t ext of which is set out in the a nnex to the present 
resolution; 
 
2 INVITES Contracting Governments to the Convention to note that the IGF Code will 
take effect on 1 January 2017 upon entry into force of amendments to chapters II-1, II-2 and 
the appendix to the annex of the Convention; 
 
3 INVITES ALSO Contracting Governments to consider the voluntary application of the 
IGF Code, as far as practicable, to cargo ships of less than 500 gross tonnage using gases or 
other low-flashpoint fuels; 
 
4 RECOGNIZES that requirements for additional low-flashpoint fuels will be added to the 
IGF Code, as and when they are developed by the Organization; 
 
5 REQUESTS the Secretary-General of the Organization to transmit certified copies of

---

5 REQUESTS the Secretary-General of the Organization to transmit certified copies of 
the present resolution and the text of the IGF Code, contained in the annex, to all Contracting 
Governments to the Convention; 
 
6 REQUESTS ALSO the Secretary-General of the Org anization to transmit copies of 
the present resolution and the text of the IGF Code contained in the annex to all Members of 
the Organization which are not Contracting Governments to the SOLAS Convention.

---

new fuels technology, the Organization will periodically revie w this Code, taking into account 
both experience and technical developments. 
 
This Code addresses all areas that need special consideration for the usage of the low-flashpoint 
fuel. The basic philosophy of the IGF Code considers the goal based approach (MSC.1/Circ.1394). 
Therefore, goals and functional requirements were specified for each section forming the basis 
for the design, construction and operation. 
 
The current version of this Code includes regulations to meet the functional requirements for 
natural gas fuel. Regulations for other low-flashpoint fuels will be added to this Code as, and  
when, they are developed by the Organization.  
 
In the meantime, for other low-flashpoint fuels, compliance with the functional requirements of 
this Code must be demonstrated through alternative design.

---

MSC 95/22/Add.1 
Annex 1, page 1 
 
 
I:\MSC\95\MSC 95-22-ADD.1 (E).docx 
ANNEX 1 
 
RESOLUTION MSC.391(95)  
(adopted on 11 June 2015) 
 
ADOPTION OF THE INTERNATIONAL CODE OF SAFETY FOR SHIPS USING GASES 
OR OTHER LOW-FLASHPOINT FUELS (IGF CODE) 
 
 
THE MARITIME SAFETY COMMITTEE, 
 
RECALLING Article 28(b) of the Convention on the International Maritime Organization 
concerning the function of the Committee, 
 
RECOGNIZING the need for a mandatory code for ships using gases or other low -flashpoint 
fuels, 
 
NOTING resolution MSC .392(95), by which it adopted, inter alia,  amendments to 
chapters II-1,II-2 and the appendix to the annex of the International Convention for the Safety 
of Life at Sea, 1974  (""the Convention""), to make the provisions of the International Code of 
Safety for Ships using Gases or other  Low-flashpoint Fuels (IGF Code) mandatory under the 
Convention, 
 
HAVING CONSIDERED, at its ninety-fifth session, the draft International Code of Safety for","The Code is intended for organizations, professionals, and stakeholders expected to align their behavior and decisions with the IGF principles."
What kinds of behavior or practices does the Code try to prevent?,"I don't have enough information from the provided document to answer your question about what kinds of behavior or practices the Code tries to prevent. The context only mentions specific requirements and guidelines for ship design, safety systems, and airlocks, but it does not explicitly state the behaviors or practices that the Code aims to prevent.","accordance with 18.4.3. 
 
.5 Where arrangements are provided for overriding the overflow control system, 
they shall be such that inadvertent operation is prevented. When this 
override is operated continuous visual indication is  to be provided at the 
navigation bridge, continuously manned central control station or onboard 
safety centre.

---

MSC 95/22/Add.1 
Annex 1, page 21 
 
 
I:\MSC\95\MSC 95-22-ADD.1 (E).docx 
5.12.2 Airlocks shall be mechanically ventilated at an overpressure relative to the adjacent 
hazardous area or space. 
 
5.12.3 The airlock shall be designed in a way that no gas can be released to safe spaces in 
case of the most critical event in the gas dangerous space separated by the airlock. The events 
shall be evaluated in the risk analysis according to 4.2. 
 
5.12.4 Airlocks shall have a simple geometrical form. They shall  provide free and easy 
passage, and shall have a deck area not less than 1.5 m2. Airlocks shall not be used for other 
purposes, for instance as store rooms. 
 
5.12.5 An audible and visual alarm system to give a warning on both sides of the airlock shall 
be provided to indicate if more than one door is moved from the closed position. 
 
5.12.6 For non-hazardous spaces with access from hazardous spaces below deck where

---

MSC 95/22/Add.1 
Annex 1, page 92 
 
 
I:\MSC\95\MSC 95-22-ADD.1 (E).docx 
 
14.3.9 For non-hazardous spaces with access from hazardous open deck where the access 
is protected by an airlock, electrical equipment which is not of the certified safe type shall be 
de-energized upon loss of overpressure in the space. 
 
14.3.10 Electrical equipment for propulsion, power generation, manoeuvring, anchoring and 
mooring, as well as  emergency fire pumps, that are located in spaces protected by airlocks, 
shall be of a certified safe type. 
 
15 CONTROL, MONITORING AND SAFETY SYSTEMS 
 
15.1 Goal 
 
The goal of this chapter is to provide for the arrangement of control, monitoring and safety 
systems that support an efficient and safe operation of the gas -fuelled installation as covered 
in the other chapters of this Code. 
 
15.2 Functional requirements 
 
This chapter is related to functional requirements in 3.2.1, 3.2.2, 3.2.11, 3.2.13 to 3.2.15, 3.2.17

---

.2 damage the ship in such a way that flooding of water below the main deck or 
any progressive flooding occur; 
 
.3 damage work areas or accommodation in such a way that persons who stay 
in such areas under normal operating conditions are injured; 
 
.4 disrupt the proper functioning of control stations and switchboard rooms 
necessary for power distribution; 
 
.5 damage life-saving equipment or associated launching arrangements; 
 
.6 disrupt the proper functioning of firefighting equipment located outside  
the explosion-damaged space; 
 
.7 affect other areas of the ship in such a way  that chain reactions involving, 
inter alia, cargo, gas and bunker oil may arise; or 
 
.8 prevent persons access to life-saving appliances or impede escape routes. 
 
                                                 
4 Double wall fuel pipes are not considered as potential sources of release.","It seeks to prevent misconduct, unethical behavior, conflicts of interest, and practices that undermine integrity and compliance."
"Does the Code include governance or compliance expectations? If yes, what is the intent?",I don't have enough information from the provided document to answer whether the Code includes governance or compliance expectations and what is the intent.,"5 REQUESTS the Secretary-General of the Organization to transmit certified copies of 
the present resolution and the text of the IGF Code, contained in the annex, to all Contracting 
Governments to the Convention; 
 
6 REQUESTS ALSO the Secretary-General of the Org anization to transmit copies of 
the present resolution and the text of the IGF Code contained in the annex to all Members of 
the Organization which are not Contracting Governments to the SOLAS Convention.

---

Convention, 
 
HAVING CONSIDERED, at its ninety-fifth session, the draft International Code of Safety for 
Ships using Gases or other Low-flashpoint Fuels, 
 
1 ADOPTS the IGF Code , the t ext of which is set out in the a nnex to the present 
resolution; 
 
2 INVITES Contracting Governments to the Convention to note that the IGF Code will 
take effect on 1 January 2017 upon entry into force of amendments to chapters II-1, II-2 and 
the appendix to the annex of the Convention; 
 
3 INVITES ALSO Contracting Governments to consider the voluntary application of the 
IGF Code, as far as practicable, to cargo ships of less than 500 gross tonnage using gases or 
other low-flashpoint fuels; 
 
4 RECOGNIZES that requirements for additional low-flashpoint fuels will be added to the 
IGF Code, as and when they are developed by the Organization; 
 
5 REQUESTS the Secretary-General of the Organization to transmit certified copies of

---

MSC 95/22/Add.1 
Annex 1, page 1 
 
 
I:\MSC\95\MSC 95-22-ADD.1 (E).docx 
ANNEX 1 
 
RESOLUTION MSC.391(95)  
(adopted on 11 June 2015) 
 
ADOPTION OF THE INTERNATIONAL CODE OF SAFETY FOR SHIPS USING GASES 
OR OTHER LOW-FLASHPOINT FUELS (IGF CODE) 
 
 
THE MARITIME SAFETY COMMITTEE, 
 
RECALLING Article 28(b) of the Convention on the International Maritime Organization 
concerning the function of the Committee, 
 
RECOGNIZING the need for a mandatory code for ships using gases or other low -flashpoint 
fuels, 
 
NOTING resolution MSC .392(95), by which it adopted, inter alia,  amendments to 
chapters II-1,II-2 and the appendix to the annex of the International Convention for the Safety 
of Life at Sea, 1974  (""the Convention""), to make the provisions of the International Code of 
Safety for Ships using Gases or other  Low-flashpoint Fuels (IGF Code) mandatory under the 
Convention, 
 
HAVING CONSIDERED, at its ninety-fifth session, the draft International Code of Safety for

---

The response and safety system for hazards and accident control shall be reviewed and tested. 
 
18 OPERATION 
 
18.1 Goal 
 
The goal of this chapter is to ensure that operational procedures for the loading, storage, 
operation, maintenance, and inspection of systems for gas or low-flashpoint fuels minimize the 
risk to personnel, the ship and the environment and that are consistent  with practices for a 
conventional oil fuelled ship whilst taking into account the nature of the liquid or gaseous fuel. 
 
18.2 Functional requirements 
 
This chapter relates to the functional requirements in 3.2.1 to 3.2.3, 3.2.9, 3.2.11, 3.2.15, 3.2.16 
and 3.2.17. In particular the following apply: 
 
.1 a copy of this Code, or national regulations incorporating the provisions of 
this Code, shall be on board every ship covered by this Code; 
 
.2 maintenance procedures and information for all gas related installations shall 
be available on board;","Yes. It provides governance and compliance expectations to make responsibilities clear, improve accountability, and reduce policy violations."
How does the Code describe accountability when rules are not followed?,I don't have enough information from the provided document to answer your question about how the Code describes accountability when rules are not followed.,"6.9 Regulations for the maintaining of fuel storage condition .............................. 62 
6.10 Regulations on atmospheric control within the fuel containment system ..... 63 
6.11 Regulations on atmosphere control within fuel storage hold spaces (Fuel 
containment systems other than type C independent tanks) ......................... 64 
6.12 Regulations on environmental control of spaces surrounding type C 
independent tanks ............................................................................................... 64 
6.13 Regulations on inerting ....................................................................................... 64 
6.14 Regulations on inert gas production and storage on board ............................ 65 
7 MATERIAL AND GENERAL PIPE DESIGN ............................................................ 65 
7.1 Goal ....................................................................................................................... 65

---

The response and safety system for hazards and accident control shall be reviewed and tested. 
 
18 OPERATION 
 
18.1 Goal 
 
The goal of this chapter is to ensure that operational procedures for the loading, storage, 
operation, maintenance, and inspection of systems for gas or low-flashpoint fuels minimize the 
risk to personnel, the ship and the environment and that are consistent  with practices for a 
conventional oil fuelled ship whilst taking into account the nature of the liquid or gaseous fuel. 
 
18.2 Functional requirements 
 
This chapter relates to the functional requirements in 3.2.1 to 3.2.3, 3.2.9, 3.2.11, 3.2.15, 3.2.16 
and 3.2.17. In particular the following apply: 
 
.1 a copy of this Code, or national regulations incorporating the provisions of 
this Code, shall be on board every ship covered by this Code; 
 
.2 maintenance procedures and information for all gas related installations shall 
be available on board;

---

.1 an audible and visual alarm shall be given at a manned location; 
and 
 
.2 if overpressure cannot be immediately restored, automatic or 
programmed, disconnection of electrical installations according to a 
recognized standard26 shall be required. 
 
13.3.10 Non-hazardous spaces with entry openings to a hazardous enclosed space shall be 
arranged with an airlock and the hazardous space shall be maintained at underpressure 
relative to the non-hazardous space. Operation of the extraction ventilation in the hazardous 
space shall be monitored and in the event of failure of the extraction ventilation: 
 
.1 an audible and visual alarm shall be given at a manned location; and 
 
.2 if underpressure cannot be immediately restored, automatic or programmed, 
disconnection of electrical installations according to a recognized standard 
in the non-hazardous space shall be required. 
 
13.4 Regulations for tank connection space

---

MSC 95/22/Add.1 
Annex 1, page 124 
 
 
I:\MSC\95\MSC 95-22-ADD.1 (E).docx 
PART D 
 
19 TRAINING 
 
19.1 Goal 
 
The goal of this chapter is to ensure that seafarers on board ships to which this Code appl ies 
are adequately qualified, trained and experienced. 
 
19.2 Functional requirements 
 
Companies shall ensure that seafarers on board ships using gases or other low -flashpoint 
fuels shall have completed training to attain the abilities that are appropriate to the capacity to 
be filled and duties and responsibilities to be taken up, taking into account the provisions given 
in the STCW Convention and Code, as amended. 
 
 
___________","The Code emphasizes accountability mechanisms so non-compliance can be identified, addressed, and corrected through defined processes."
What is the expected benefit of following the IGF Code consistently?,"I don't have enough information from the provided document to answer your question. The context only mentions the adoption and implementation of the IGF Code, but it does not specify any expected benefits of following the code consistently.","Convention, 
 
HAVING CONSIDERED, at its ninety-fifth session, the draft International Code of Safety for 
Ships using Gases or other Low-flashpoint Fuels, 
 
1 ADOPTS the IGF Code , the t ext of which is set out in the a nnex to the present 
resolution; 
 
2 INVITES Contracting Governments to the Convention to note that the IGF Code will 
take effect on 1 January 2017 upon entry into force of amendments to chapters II-1, II-2 and 
the appendix to the annex of the Convention; 
 
3 INVITES ALSO Contracting Governments to consider the voluntary application of the 
IGF Code, as far as practicable, to cargo ships of less than 500 gross tonnage using gases or 
other low-flashpoint fuels; 
 
4 RECOGNIZES that requirements for additional low-flashpoint fuels will be added to the 
IGF Code, as and when they are developed by the Organization; 
 
5 REQUESTS the Secretary-General of the Organization to transmit certified copies of

---

new fuels technology, the Organization will periodically revie w this Code, taking into account 
both experience and technical developments. 
 
This Code addresses all areas that need special consideration for the usage of the low-flashpoint 
fuel. The basic philosophy of the IGF Code considers the goal based approach (MSC.1/Circ.1394). 
Therefore, goals and functional requirements were specified for each section forming the basis 
for the design, construction and operation. 
 
The current version of this Code includes regulations to meet the functional requirements for 
natural gas fuel. Regulations for other low-flashpoint fuels will be added to this Code as, and  
when, they are developed by the Organization.  
 
In the meantime, for other low-flashpoint fuels, compliance with the functional requirements of 
this Code must be demonstrated through alternative design.

---

5 REQUESTS the Secretary-General of the Organization to transmit certified copies of 
the present resolution and the text of the IGF Code, contained in the annex, to all Contracting 
Governments to the Convention; 
 
6 REQUESTS ALSO the Secretary-General of the Org anization to transmit copies of 
the present resolution and the text of the IGF Code contained in the annex to all Members of 
the Organization which are not Contracting Governments to the SOLAS Convention.

---

MSC 95/22/Add.1 
Annex 1, page 1 
 
 
I:\MSC\95\MSC 95-22-ADD.1 (E).docx 
ANNEX 1 
 
RESOLUTION MSC.391(95)  
(adopted on 11 June 2015) 
 
ADOPTION OF THE INTERNATIONAL CODE OF SAFETY FOR SHIPS USING GASES 
OR OTHER LOW-FLASHPOINT FUELS (IGF CODE) 
 
 
THE MARITIME SAFETY COMMITTEE, 
 
RECALLING Article 28(b) of the Convention on the International Maritime Organization 
concerning the function of the Committee, 
 
RECOGNIZING the need for a mandatory code for ships using gases or other low -flashpoint 
fuels, 
 
NOTING resolution MSC .392(95), by which it adopted, inter alia,  amendments to 
chapters II-1,II-2 and the appendix to the annex of the International Convention for the Safety 
of Life at Sea, 1974  (""the Convention""), to make the provisions of the International Code of 
Safety for Ships using Gases or other  Low-flashpoint Fuels (IGF Code) mandatory under the 
Convention, 
 
HAVING CONSIDERED, at its ninety-fifth session, the draft International Code of Safety for","Consistent adherence improves trust, transparency, and responsible decision-making across the organizations and participants covered by the Code."
